<?xml version="1.0" encoding="UTF-8"?>
<model xmlns="http://dbfound.googlecode.com/model" xmlns:xsi="http://www.w3.org/2001/XMLSchema-instance" xsi:schemaLocation="http://dbfound.googlecode.com/model https://raw.githubusercontent.com/nfwork/dbfound/master/tags/model.xsd">
	<query pagerSize="10">
		<sql>
		  <![CDATA[
			SELECT
			    t.teacher_id,
				t.teacher_code,
				t.teacher_name,
				t.email,
				t.enable_flag,
				t.telphone_num,
				t.last_update_by,
				DATE_FORMAT(t.create_date,'%Y-%m-%d') create_date,
				DATE_FORMAT(t.last_update_date,'%Y-%m-%d') last_update_date,
			    (select CONCAT(CONCAT(user_code,'-'),user_name) from sys_user where user_id =t.last_update_by) last_update_user
			FROM fnd_teacher t
			#WHERE_CLAUSE#
			order by t.teacher_code
		   ]]>
		</sql>
		<filter name="timefrom" express="create_date &gt;= ${@timefrom}  " />
		<filter name="timeto" express="create_date &lt;= ${@timeto} " />
		<filter name="status_code" express="enable_flag = ${@status_code} " />
		<filter name="teacher_code" express="teacher_code like ${@teacher_code} " />
		<filter name="teacher_name" express="teacher_name like ${@teacher_name} " />
	</query>

	<execute name="add">
		<param name="teacher_code" dataType="varchar" />
		<param name="teacher_name" dataType="varchar" />
		<param name="email" dataType="varchar" />
		<param name="enable_flag" dataType="varchar" />
		<param name="telphone_num" dataType="varchar" />
		<param name="role_id" dataType="number" ioType="out" />
		<param name="user_id" dataType="number" scope="session" />
		<sqls>
			<collisionSql
				where="exists (select 1 from fnd_teacher where teacher_code= ${@teacher_code})"
				message="编号:#{@teacher_code} 已经使用！" />
			<executeSql>
			   <![CDATA[
				INSERT INTO fnd_teacher
					(teacher_code,
					teacher_name,
					email,
					telphone_num,
					enable_flag,
					create_by,
					last_update_by,
					create_date,
					last_update_date)
				VALUES (${@teacher_code},
					${@teacher_name},
					${@email},
					${@telphone_num},
					${@enable_flag},
					${@user_id},
					${@user_id},
					NOW(),
					NOW())
				 ]]>
			</executeSql>
			<whenSql when="not exists (select 1 from sys_user where user_code= ${@teacher_code})" >
			    <querySql>
				   <![CDATA[
					 SELECT
					    r.role_id
					 FROM sys_role r
					 where role_code = 'TEACHER'
					 ]]>
				</querySql>
				<executeSql>
				   <![CDATA[
					 INSERT INTO sys_user
					   (user_code,
						user_name,
						password,
						role_id,
						status,
						create_by,
						create_date,
						last_update_by,
						last_update_date)
					VALUES
						(${@teacher_code},
						${@teacher_name},
						'123456',
						${@role_id},
						${@enable_flag},
						${@user_id},
						NOW(),
						${@user_id},
						NOW())
					 ]]>
				</executeSql>
			</whenSql>
		</sqls>
	</execute>

	<execute name="update">
		<param name="teacher_id" dataType="number" />
		<param name="teacher_code" dataType="varchar" />
		<param name="teacher_name" dataType="varchar" />
		<param name="enable_flag" dataType="varchar" />
		<param name="email" dataType="varchar" />
		<param name="telphone_num" dataType="varchar" />
		<param name="user_id" dataType="number" scope="session" />
		<sqls>
			<executeSql>
			  <![CDATA[
				update fnd_teacher set
					teacher_name = ${@teacher_name} ,
					email        = ${@email} ,
					enable_flag  = ${@enable_flag},
					telphone_num = ${@telphone_num} ,
					last_update_by =${@user_id} ,
					last_update_date = NOW()
				where teacher_id = ${@teacher_id}
				]]>
			</executeSql>
			<executeSql>
			  <![CDATA[
				update sys_user set
					status  = ${@enable_flag},
					last_update_by =${@user_id} ,
					last_update_date = NOW()
				where user_code = ${@teacher_code}
				  and status != ${@enable_flag}
				]]>
			</executeSql>
		</sqls>
	</execute>

	<query name="combo">
		<sql>
		  <![CDATA[
			SELECT
				t.teacher_id ,
				concat(concat(teacher_code,'-'),teacher_name) teacher_name
			FROM fnd_teacher t
			order by teacher_code
		  ]]>
		</sql>
	</query>
</model>