<?xml version="1.0" encoding="UTF-8"?>
<model xmlns="http://dbfound.googlecode.com/model" xmlns:xsi="http://www.w3.org/2001/XMLSchema-instance" xsi:schemaLocation="http://dbfound.googlecode.com/model https://raw.githubusercontent.com/nfwork/dbfound/master/tags/model.xsd">
	<query>
		<sql>
		  <![CDATA[
			SELECT * FROM gc_employee
			#WHERE_CLAUSE#
			order by employee_code
		   ]]>
		</sql>
		<filter name="employee_code" express="employee_code like ${@employee_code} " />
		<filter name="employee_name" express="employee_name like ${@employee_name} " />
	</query>
	
	<query name="combo">
		<sql>
		  <![CDATA[
			SELECT e.employee_id,
			       concat(concat(employee_code,'-'),employee_name) employee_name
            FROM gc_employee e
			order by employee_code
		   ]]>
		</sql>
	</query>

	<execute name="add">
		<param name="employee_code" dataType="varchar" />
		<param name="employee_name" dataType="varchar" />
		<sqls>
			<collisionSql
				where="exists (select 1 from gc_employee where employee_code= ${@employee_code})"
				message="工人编号:#{@employee_code} 已经使用！" />
			<executeSql>
			   <![CDATA[
				INSERT INTO gc_employee
					(employee_code,
					 employee_name
					)
				VALUES (${@employee_code},
					${@employee_name}
					)
				 ]]>
			</executeSql>
		</sqls>
	</execute>

	<execute name="update">
		<param name="employee_id" dataType="number" />
		<param name="employee_name" dataType="varchar" />
		<param name="price" dataType="number" />
		<sqls>
			<executeSql>
			  <![CDATA[
				update gc_employee set
					employee_name = ${@employee_name}
				where employee_id = ${@employee_id}
				]]>
			</executeSql>
		</sqls>
	</execute>

</model>