<?xml version="1.0" encoding="UTF-8"?>
<model xmlns="http://dbfound.googlecode.com/model" xmlns:xsi="http://www.w3.org/2001/XMLSchema-instance"
	xsi:schemaLocation="http://dbfound.googlecode.com/model https://raw.githubusercontent.com/nfwork/dbfound/master/tags/model.xsd">

	<query>
		<param name="project_id" dataType="number" scope="param" />
		<param name="work_date" dataType="varchar" scope="param" />
		<sql>
		  <![CDATA[
			SELECT e.*,
			       ${@work_date} work_date,
			       ${@project_id} project_id,
			       (select CONCAT(CONCAT(project_code,'-'),project_name) from gc_project g where g.project_id = ${@project_id}) project_name
			 FROM gc_employee e
			 where not exists (
			   select 1 from gc_work_record r
			   where e.employee_id = r.employee_id
			    and r.project_id = ${@project_id}
			    and r.work_date = ${@work_date}
			 )
		   ]]>
		</sql>
	</query>
	
	<query name="displayQuery">
		<param name="project_id" dataType="number" scope="param" />
		<param name="employee_id" dataType="number" />
		<param name="date" dataType="varchar" scope="param" />
		<sql>
		  <![CDATA[
			   select * from gc_work_record r
			   where r.project_id = ${@project_id}
			    and r.employee_id = ${@employee_id}
			    and r.work_date like '#{@date}%'
		   ]]>
		</sql>
	</query>

	<query name="unRegist">
		<sql>
		  <![CDATA[
			SELECT r.*,
				   e.employee_code,
				   e.employee_name,
			       (select CONCAT(CONCAT(project_code,'-'),project_name) from gc_project g where g.project_id = r.project_id) project_name
			 FROM gc_work_record r,gc_employee e
			 where r.employee_id = e.employee_id
			  and IFNULL(r.settlement_flag,'N') != 'Y'
			 #AND_CLAUSE#
		   ]]>
		</sql>
		<filter name="project_id" express="project_id = ${@project_id} " />
		<filter name="work_date" express="r.work_date = ${@work_date} " />
	</query>

	<execute name="regiest">
		<param name="employee_id" dataType="number" />
		<param name="project_id" dataType="number" scope="param" />
		<param name="work_date" dataType="varchar" scope="param" />
		<sqls>
			<whenSql
				when="not exists (select 1 from gc_work_record 
		                                       where employee_id = ${@employee_id}
		                                        and project_id = ${@project_id}
		                                        and work_date = ${@work_date}
		                                       )">
				<executeSql>
				  <![CDATA[
					 insert into gc_work_record(employee_id,
												project_id,
												work_date
												)
										values(${@employee_id},
										         ${@project_id},
										         ${@work_date})
					]]>
				</executeSql>
			</whenSql>
		</sqls>
	</execute>

	<execute name="unAddRegiest">
		<param name="employee_id" dataType="number" />
		<param name="project_id" dataType="number" scope="param" />
		<param name="work_date" dataType="varchar" scope="param" />
		<param name="work_id" dataType="number" />
		<sqls>
		    <querySql>
		       <![CDATA[
				 select work_id from gc_work_record 
				  where employee_id = ${@employee_id}
				    and project_id = ${@project_id}
				    and work_date = ${@work_date}
				]]>
		    </querySql>
		    <collisionSql where="exists (select 1 from gc_work_record 
				  where work_id = ${@work_id}
				   and IFNULL(settlement_flag,'N') = 'Y')" message="已结算工时，不能取消！"/>
			<executeSql>
			  <![CDATA[
				 delete from gc_work_record 
				  where work_id = ${@work_id}
				]]>
			</executeSql>
		</sqls>
	</execute>
	
	<execute name="unRegiest">
		<param name="work_id" dataType="number" />
		<param name="employee_name" dataType="varchar" />
		<param name="work_date" dataType="varchar" />
		<sqls>
		    <collisionSql where="exists (select 1 from gc_work_record 
				  where work_id = ${@work_id}
				   and IFNULL(settlement_flag,'N') = 'Y')" message="员工#{@employee_name}在#{@work_date}的报公已经结算，不能取消！"/>
			<executeSql>
			  <![CDATA[
				 delete from gc_work_record 
				  where work_id = ${@work_id}
				]]>
			</executeSql>
		</sqls>
	</execute>
</model>